{
  "schema_version": "1.0",
  "platform": {
    "name": "F5 Distributed Cloud",
    "slug": "f5-distributed-cloud",
    "category": "Identity, security, and networking"
  },
  "audit_status": "needs-human-judgment",
  "audited_at": "2026-07-22",
  "source_record_sha256": "71505f20bcb8038f0b72502659fa420a5afb97eb2f07419da0b10444d97358af",
  "starting_state": {
    "boundary": "account creation",
    "assumptions": [
      "The developer has a supported browser and can receive email when the selected route requires it.",
      "No platform account, tenant, credentials, or product resources exist yet."
    ]
  },
  "developer_goal": "Create or obtain access to an F5 Distributed Cloud SaaS account, complete Console onboarding preferences, and reach Home; resolve which service quickstart is first success beyond Console entry.",
  "first_success": {
    "outcome": "The developer reaches Console Home with workspace tiles after initial preferences, if Console onboarding is the selected terminal.",
    "observable_signal": "Console Home loads with Common Workspaces tiles.",
    "source_ids": [
      "S2"
    ]
  },
  "route_selection": {
    "surface": "F5 Distributed Cloud Console onboarding versus service-specific quickstarts",
    "rule": "Reconstruct complete official candidate routes, prefer no payment/admin/approval when possible, then minimize required actions; leave consequential ties unresolved.",
    "selected": null,
    "candidates": [
      {
        "name": "Console signup and initial preference onboarding to Home",
        "status": "unresolved",
        "reason": "Many service-specific quickstarts exist; Console Home may be too weak as first success versus deploying a named service."
      },
      {
        "name": "Service-specific quickstart such as Secure Kubernetes Gateway or HTTP load balancer CDN",
        "status": "unresolved",
        "reason": "Peer outcomes with different required actions; lexicographic winner not established."
      }
    ]
  },
  "required_path": [
    {
      "step_number": 1,
      "kind": "account",
      "interface": "web-ui",
      "action": "Sign up for or access an F5 Distributed Cloud SaaS account.",
      "required_fields": [
        {
          "label": "Signup and tenant access fields",
          "field_type": "other",
          "evidence_state": "unverified",
          "source_ids": [
            "S3"
          ]
        }
      ],
      "observable_result": "The developer can log into Console.",
      "evidence_state": "unverified",
      "source_ids": [
        "S2",
        "S3"
      ]
    },
    {
      "step_number": 2,
      "kind": "product-interaction",
      "interface": "web-ui",
      "action": "Accept initial terms if shown and select work domains and skill level.",
      "required_fields": [
        {
          "label": "Work domain selections",
          "field_type": "select",
          "evidence_state": "documented",
          "source_ids": [
            "S2"
          ]
        },
        {
          "label": "Skill level",
          "field_type": "select",
          "evidence_state": "documented",
          "source_ids": [
            "S2"
          ]
        },
        {
          "label": "Initial terms acceptance if presented",
          "field_type": "agreement",
          "evidence_state": "unverified",
          "source_ids": [
            "S2"
          ]
        }
      ],
      "observable_result": "Console Home is populated with workspace tiles.",
      "evidence_state": "unverified",
      "source_ids": [
        "S2"
      ]
    }
  ],
  "prerequisites": [
    {
      "description": "A SaaS account in Console is required; signup is linked from the getting-started guide.",
      "source_ids": [
        "S2"
      ]
    }
  ],
  "external_gates": [
    {
      "description": "Administrator role assumptions in the Console guide may not match every fresh tenant invite path.",
      "source_ids": [
        "S2"
      ]
    }
  ],
  "unavoidable_waits": [],
  "platform_outcomes": [
    {
      "description": "Console customizes visible workspaces from selected work domains.",
      "source_ids": [
        "S2"
      ]
    }
  ],
  "excluded": [
    {
      "item": "Deploying a specific service after Home is reached",
      "reason": "Excluded until the selected first-success service is chosen.",
      "source_ids": [
        "S1"
      ]
    }
  ],
  "sources": [
    {
      "id": "S1",
      "title": "Quickstart index",
      "url": "https://docs.cloud.f5.com/docs-v2/platform/quickstart",
      "source_type": "official-documentation",
      "accessed_at": "2026-07-22",
      "evidence_supported": [
        "Many service quickstarts"
      ]
    },
    {
      "id": "S2",
      "title": "Get Started with Distributed Cloud Console",
      "url": "https://docs.cloud.f5.com/docs-v2/platform/quickstart/get-started-on-console",
      "source_type": "official-documentation",
      "accessed_at": "2026-07-22",
      "evidence_supported": [
        "Console onboarding preferences",
        "Home"
      ]
    },
    {
      "id": "S3",
      "title": "F5 Distributed Cloud Console signup",
      "url": "https://console.ves.volterra.io/signup/start",
      "source_type": "observed-public-ui",
      "accessed_at": "2026-07-22",
      "evidence_supported": [
        "Signup entry"
      ]
    },
    {
      "id": "S4",
      "title": "Distributed Cloud Services Overview",
      "url": "https://docs.cloud.f5.com/docs-v2/platform/overview",
      "source_type": "official-documentation",
      "accessed_at": "2026-07-22",
      "evidence_supported": [
        "Platform overview"
      ]
    }
  ],
  "uncertainties": [
    {
      "question": "Is Console Home the first success, or must a named service quickstart be completed?",
      "impact": "Changes path length and required product interactions substantially.",
      "evidence_needed": "Explicit first-success selection among Console Home and the quickstart index services."
    },
    {
      "question": "What exact signup fields and tenant-provisioning waits appear for a fresh self-service account?",
      "impact": "Blocks verified account fields.",
      "evidence_needed": "Fresh-account signup walkthrough through Console Home."
    }
  ],
  "counts": null
}
