{
  "schema_version": "1.0",
  "platform": {
    "name": "Encore",
    "slug": "encore",
    "category": "Cloud and application runtimes"
  },
  "audit_status": "needs-human-judgment",
  "audited_at": "2026-07-22",
  "source_record_sha256": "0a3f038ab1545e6d34a2fa9d4f71c7958b0d3b1d927cb6a87c36f30830f261c1",
  "starting_state": {
    "boundary": "account creation",
    "assumptions": [
      "The developer has a supported browser and can receive email when the selected route requires it.",
      "No platform account, tenant, credentials, or product resources exist yet.",
      "Developer has a compatible local development environment (e.g., macOS with Homebrew or equivalent shell environment).",
      "Developer has basic knowledge of TypeScript or Go programming languages."
    ]
  },
  "developer_goal": "Start building a backend application with Encore by installing the CLI and creating a new app.",
  "first_success": {
    "outcome": "Developer runs the app locally and successfully calls the API endpoint, receiving the expected JSON response",
    "observable_signal": "Receiving the JSON response {\"Message\": \"Hello, world!\"} from the API endpoint call",
    "source_ids": [
      "S2"
    ]
  },
  "route_selection": {
    "surface": "Encore CLI and local development environment",
    "rule": "Reconstruct complete official candidate routes, prefer no payment/admin/approval when possible, then minimize required actions; leave consequential ties unresolved.",
    "selected": null,
    "candidates": [
      {
        "name": "Encore CLI and local development environment",
        "status": "unresolved",
        "reason": "Machine-drafted primary path only; not confirmed as the lexicographic shortest required route."
      }
    ]
  },
  "required_path": [
    {
      "step_number": 1,
      "kind": "implementation",
      "interface": "cli",
      "action": "Install Encore CLI",
      "required_fields": [
        {
          "label": "System shell command",
          "field_type": "other",
          "evidence_state": "unverified",
          "source_ids": [
            "S2",
            "S6"
          ],
          "notes": "Mapped from machine-drafted primary_path; field inventory not independently audited."
        }
      ],
      "observable_result": "Encore CLI command is recognized and runs",
      "evidence_state": "unverified",
      "source_ids": [
        "S2",
        "S6"
      ]
    },
    {
      "step_number": 2,
      "kind": "account",
      "interface": "cli",
      "action": "Create a new Encore app",
      "required_fields": [
        {
          "label": "CLI prompts and user selections",
          "field_type": "other",
          "evidence_state": "unverified",
          "source_ids": [
            "S2"
          ],
          "notes": "Mapped from machine-drafted primary_path; field inventory not independently audited."
        }
      ],
      "observable_result": "App folder with starter code is created",
      "evidence_state": "unverified",
      "source_ids": [
        "S2"
      ]
    },
    {
      "step_number": 3,
      "kind": "implementation",
      "interface": "ide",
      "action": "Open and review the starter app code",
      "required_fields": [
        {
          "label": "Source code files",
          "field_type": "other",
          "evidence_state": "unverified",
          "source_ids": [
            "S2"
          ],
          "notes": "Mapped from machine-drafted primary_path; field inventory not independently audited."
        }
      ],
      "observable_result": "Developer can identify the API endpoint code",
      "evidence_state": "unverified",
      "source_ids": [
        "S2"
      ]
    },
    {
      "step_number": 4,
      "kind": "implementation",
      "interface": "cli",
      "action": "Run the Encore app locally",
      "required_fields": [
        {
          "label": "CLI command",
          "field_type": "other",
          "evidence_state": "unverified",
          "source_ids": [
            "S2"
          ],
          "notes": "Mapped from machine-drafted primary_path; field inventory not independently audited."
        }
      ],
      "observable_result": "Local environment is up and running without errors",
      "evidence_state": "unverified",
      "source_ids": [
        "S2"
      ]
    },
    {
      "step_number": 5,
      "kind": "implementation",
      "interface": "browser",
      "action": "Open the Local Development Dashboard",
      "required_fields": [
        {
          "label": "URL in browser",
          "field_type": "other",
          "evidence_state": "unverified",
          "source_ids": [
            "S2"
          ],
          "notes": "Mapped from machine-drafted primary_path; field inventory not independently audited."
        }
      ],
      "observable_result": "Dashboard shows API explorer and service catalog",
      "evidence_state": "unverified",
      "source_ids": [
        "S2"
      ]
    },
    {
      "step_number": 6,
      "kind": "implementation",
      "interface": "cli",
      "action": "Call the API endpoint",
      "required_fields": [
        {
          "label": "HTTP GET request",
          "field_type": "other",
          "evidence_state": "unverified",
          "source_ids": [
            "S2"
          ],
          "notes": "Mapped from machine-drafted primary_path; field inventory not independently audited."
        }
      ],
      "observable_result": "Response contains {\"Message\": \"Hello, world!\"}",
      "evidence_state": "unverified",
      "source_ids": [
        "S2"
      ]
    }
  ],
  "prerequisites": [
    {
      "description": "Install the Encore CLI appropriate for your system (e.g., via Homebrew on macOS)",
      "source_ids": [
        "S2",
        "S6"
      ]
    },
    {
      "description": "Create a free Encore Cloud account when prompted during app creation to enable cloud deployment and secret management",
      "source_ids": [
        "S2"
      ]
    },
    {
      "description": "Basic familiarity with TypeScript programming language (or Go, but quick start uses TypeScript)",
      "source_ids": [
        "S2",
        "S3"
      ]
    }
  ],
  "external_gates": [
    {
      "description": "Creating a free Encore Cloud account is required to manage secrets and enable cloud deployments",
      "source_ids": [
        "S2"
      ]
    },
    {
      "description": "Installing the Encore CLI is required to develop and run Encore apps locally",
      "source_ids": [
        "S2",
        "S6"
      ]
    }
  ],
  "unavoidable_waits": [],
  "platform_outcomes": [
    {
      "description": "Successfully run a local Encore app and receive a valid API response from the local development environment",
      "source_ids": [
        "S2"
      ]
    }
  ],
  "excluded": [],
  "sources": [
    {
      "id": "S1",
      "title": "GitHub - encoredev/encore: The infrastructure platform for the ...",
      "url": "https://github.com/encoredev/encore",
      "source_type": "official-documentation",
      "accessed_at": "2026-07-22",
      "evidence_supported": [
        "GitHub - encoredev/encore: The infrastructure platform for the ..."
      ]
    },
    {
      "id": "S2",
      "title": "Quick Start Guide \u2013 Learn how to build backends with Encore.ts \u2014 Encore Docs",
      "url": "https://encore.dev/docs/ts/quick-start",
      "source_type": "official-documentation",
      "accessed_at": "2026-07-22",
      "evidence_supported": [
        "Quick Start Guide \u2013 Learn how to build backends with Encore.ts \u2014 Encore Docs",
        "Quick Start Guide",
        "Install the Encore CLI",
        "Create your app"
      ]
    },
    {
      "id": "S3",
      "title": "Start building backends using Encore.ts",
      "url": "https://encore.dev/docs/ts",
      "source_type": "official-documentation",
      "accessed_at": "2026-07-22",
      "evidence_supported": [
        "Start building backends using Encore.ts",
        "Overview",
        "Features"
      ]
    },
    {
      "id": "S4",
      "title": "Get Started with Encore - Encore SDK",
      "url": "https://docs.encorekit.com/quickstart",
      "source_type": "official-documentation",
      "accessed_at": "2026-07-22",
      "evidence_supported": [
        "Get Started with Encore - Encore SDK",
        "Welcome to Encore",
        "Get Started in Three Steps",
        "Choose Your Platform"
      ]
    },
    {
      "id": "S5",
      "title": "Development Platform for your cloud on AWS & GCP",
      "url": "https://encore.dev/",
      "source_type": "official-documentation",
      "accessed_at": "2026-07-22",
      "evidence_supported": [
        "Development Platform for your cloud on AWS & GCP",
        "Overview",
        "Features",
        "Quotes"
      ]
    },
    {
      "id": "S6",
      "title": "Encore",
      "url": "https://encore.dev/ts",
      "source_type": "official-documentation",
      "accessed_at": "2026-07-22",
      "evidence_supported": [
        "Encore",
        "Start locally",
        "Install the CLI and create an app"
      ]
    }
  ],
  "uncertainties": [
    {
      "question": "Has the machine-drafted Encore route been independently shortest-path audited?",
      "impact": "Action counts and peer comparison must stay withheld until a human audit passes.",
      "evidence_needed": "Complete a shortest-path audit against current official docs and mark verified only when evidence supports it."
    }
  ],
  "counts": null
}
