{
  "schema_version": "1.0",
  "platform": {
    "name": "CyberArk",
    "slug": "cyberark",
    "category": "Identity, security, and networking"
  },
  "audit_status": "needs-human-judgment",
  "audited_at": "2026-07-22",
  "source_record_sha256": "c55508534cbacea35f49d49bc265923f616ce6182228f73c374d718d8fe0bb89",
  "starting_state": {
    "boundary": "account creation",
    "assumptions": [
      "The developer has a supported browser and can receive email when the selected route requires it.",
      "No platform account, tenant, credentials, or product resources exist yet."
    ]
  },
  "developer_goal": "Identify the CyberArk-wide first-mile product surface and complete its documented first success from a cold start.",
  "first_success": {
    "outcome": "If Conjur OSS demo is selected, BotApp retrieves the stored secret and shows the quickstart congratulations message.",
    "observable_signal": "/tmp/program.sh displays the stored secret and the repository congratulations text appears.",
    "source_ids": [
      "S1"
    ]
  },
  "route_selection": {
    "surface": "CyberArk Conjur OSS Docker Compose demo versus commercial CyberArk product onboarding",
    "rule": "Reconstruct complete official candidate routes, prefer no payment/admin/approval when possible, then minimize required actions; leave consequential ties unresolved.",
    "selected": null,
    "candidates": [
      {
        "name": "Conjur OSS Docker Compose store-and-retrieve demo",
        "status": "unresolved",
        "reason": "Official quickstart is demo-only and may not represent commercial CyberArk first mile."
      },
      {
        "name": "Commercial CyberArk Identity Security Platform self-service route",
        "status": "unresolved",
        "reason": "No single public self-service first-success path was established as the product-neutral CyberArk default from current sources."
      }
    ]
  },
  "required_path": [
    {
      "step_number": 1,
      "kind": "implementation",
      "interface": "cli",
      "action": "Clone the Conjur quickstart repository and accept its demo-only scope, if that route is selected.",
      "required_fields": [
        {
          "label": "Repository clone",
          "field_type": "command",
          "evidence_state": "documented",
          "source_ids": [
            "S1"
          ]
        }
      ],
      "observable_result": "Local quickstart files are available.",
      "evidence_state": "documented",
      "source_ids": [
        "S1"
      ]
    },
    {
      "step_number": 2,
      "kind": "implementation",
      "interface": "cli",
      "action": "Start the Docker Compose demo environment and follow policy, secret store, and BotApp steps.",
      "required_fields": [
        {
          "label": "Docker Compose and demo script commands",
          "field_type": "command",
          "evidence_state": "unverified",
          "source_ids": [
            "S1"
          ]
        }
      ],
      "observable_result": "BotApp retrieves the secret and congratulations text appears.",
      "evidence_state": "unverified",
      "source_ids": [
        "S1"
      ]
    }
  ],
  "prerequisites": [
    {
      "description": "Docker with Docker Compose is required for the Conjur OSS demo route.",
      "source_ids": [
        "S1"
      ]
    }
  ],
  "external_gates": [],
  "unavoidable_waits": [
    {
      "description": "Container image pulls and demo service startup.",
      "source_ids": [
        "S1"
      ]
    }
  ],
  "platform_outcomes": [
    {
      "description": "Conjur OSS stores and returns the demo secret to BotApp.",
      "source_ids": [
        "S1"
      ]
    }
  ],
  "excluded": [
    {
      "item": "Using the demo for production Conjur deployment",
      "reason": "Repository explicitly forbids production use of this quickstart.",
      "source_ids": [
        "S1"
      ]
    }
  ],
  "sources": [
    {
      "id": "S1",
      "title": "cyberark/conjur-quickstart",
      "url": "https://github.com/cyberark/conjur-quickstart",
      "source_type": "official-documentation",
      "accessed_at": "2026-07-22",
      "evidence_supported": [
        "Demo-only Conjur OSS quickstart",
        "Store and retrieve secret"
      ]
    }
  ],
  "uncertainties": [
    {
      "question": "Should a CyberArk-wide first mile use Conjur OSS demo or a current commercial product surface?",
      "impact": "Product boundary changes whether account creation, sales entitlement, or local Docker is in path.",
      "evidence_needed": "Official CyberArk developer getting-started entry that names one self-service first success for this corpus slug."
    },
    {
      "question": "What exact Compose and script commands are required on a fresh machine today?",
      "impact": "Blocks verified implementation step list.",
      "evidence_needed": "Re-run the current repository README steps and capture each required command."
    }
  ],
  "counts": null
}
