{
  "schema_version": "1.0",
  "platform": {
    "name": "Google Cloud Platform",
    "slug": "google-cloud-platform",
    "category": "Cloud and application runtimes"
  },
  "audit_status": "needs-human-judgment",
  "audited_at": "2026-07-22",
  "source_record_sha256": "bfac14d0db5288d260739ff2f6e9ab75f8c0ae21ffa99655cdfb5074e40585eb",
  "starting_state": {
    "boundary": "account creation",
    "assumptions": [
      "The developer has a supported browser and a Google identity or can create one.",
      "No Google Cloud project, billing account, product, or job-function path exists yet."
    ]
  },
  "developer_goal": "Create a Google Cloud account and reach the earliest meaningful hosted workload first success on Google Cloud.",
  "first_success": {
    "outcome": "Unresolved: official platform get-started presents co-equal job-function setup paths rather than one workload terminal.",
    "observable_signal": "A bounded product route such as opening a deployed Cloud Run sample URL is a candidate, not a platform-selected default.",
    "source_ids": ["S1", "S2"]
  },
  "route_selection": {
    "surface": "Google Cloud console and Free Trial signup, after platform get-started",
    "rule": "Select a shortest complete route only after the job-function or product outcome is fixed; do not invent a winner among co-equal official paths.",
    "selected": null,
    "candidates": [
      {
        "name": "Platform get-started by job function",
        "status": "unresolved",
        "reason": "Get started with Google Cloud lists six co-equal setup tracks: IT administration, FinOps, Security, DevOps, Application development, and Data analysis."
      },
      {
        "name": "Cloud Run sample container console deploy",
        "status": "unresolved",
        "reason": "Complete console path to a public service URL, but it is one product quickstart among many Google Cloud products and is not designated as the platform default."
      },
      {
        "name": "Jump Start Solutions or Free Tier product trials",
        "status": "unresolved",
        "reason": "Marketing and free-program pages present multiple pre-built solutions and product-specific free trials without selecting one first-success outcome."
      }
    ]
  },
  "required_path": [
    {
      "step_number": 1,
      "kind": "account",
      "interface": "web-ui",
      "action": "Create or sign in to a Google Cloud account from the Free Trial or console entry.",
      "required_fields": [
        {
          "label": "Google identity",
          "field_type": "other",
          "evidence_state": "documented",
          "source_ids": ["S2", "S3"],
          "notes": "Official pages require signing in or creating a Google Cloud account; exact public signup controls behind Google identity were not fully enumerated in this audit."
        },
        {
          "label": "Payment method for Free Trial identity verification",
          "field_type": "other",
          "evidence_state": "documented",
          "source_ids": ["S3"],
          "notes": "Free Trial signup requires a valid credit card or other payment method; covered trial usage is not billed until upgrade."
        }
      ],
      "observable_result": "The developer can open the Google Cloud console with Free Trial or billing context.",
      "evidence_state": "documented",
      "source_ids": ["S2", "S3"]
    },
    {
      "step_number": 2,
      "kind": "product-interaction",
      "interface": "web-ui",
      "action": "Select one job-function setup track or one product workload route before reconstructing the remaining required path.",
      "required_fields": [
        {
          "label": "Job function or product route",
          "field_type": "select",
          "evidence_state": "documented",
          "source_ids": ["S1"]
        }
      ],
      "observable_result": "One bounded Google Cloud first-success route is fixed.",
      "evidence_state": "documented",
      "source_ids": ["S1"]
    }
  ],
  "prerequisites": [
    {
      "description": "A Google identity that can own or access a Google Cloud billing-enabled project for most deploy quickstarts.",
      "source_ids": ["S2", "S3"]
    }
  ],
  "external_gates": [
    {
      "description": "Free Trial signup uses a payment method for identity verification and may require bank authorization holds.",
      "source_ids": ["S3"]
    }
  ],
  "unavoidable_waits": [
    {
      "description": "Payment authorization can remain pending for bank processing before Free Trial credit is fully usable.",
      "source_ids": ["S3"]
    }
  ],
  "platform_outcomes": [
    {
      "description": "Signing up for Free Trial creates a billing account with $300 Welcome credit for 90 days when identity verification succeeds.",
      "source_ids": ["S3"]
    }
  ],
  "excluded": [
    {
      "item": "Reading Get started with Google Cloud documentation",
      "reason": "Documentation is evidence for route selection, not a counted product action.",
      "source_ids": ["S1"]
    },
    {
      "item": "Committing Cloud Run as the universal Google Cloud first success",
      "reason": "The platform get-started router presents co-equal job-function paths; Cloud Run is product-specific.",
      "source_ids": ["S1", "S2"]
    }
  ],
  "sources": [
    {
      "id": "S1",
      "title": "Get started with Google Cloud",
      "url": "https://docs.cloud.google.com/docs/get-started",
      "source_type": "official-documentation",
      "accessed_at": "2026-07-22",
      "evidence_supported": [
        "Account creation or console entry",
        "Six co-equal job-function setup tracks",
        "No single platform workload terminal"
      ]
    },
    {
      "id": "S2",
      "title": "Quickstart: Deploy to Cloud Run",
      "url": "https://docs.cloud.google.com/run/docs/quickstarts/deploy-container",
      "source_type": "official-documentation",
      "accessed_at": "2026-07-22",
      "evidence_supported": [
        "Account prerequisite",
        "Console sample-container deploy steps",
        "Public service URL completion signal"
      ]
    },
    {
      "id": "S3",
      "title": "Free Google Cloud features and trial offer",
      "url": "https://docs.cloud.google.com/free/docs/free-cloud-features",
      "source_type": "official-documentation",
      "accessed_at": "2026-07-22",
      "evidence_supported": [
        "Free Trial $300 credit",
        "Payment method required for identity verification",
        "Authorization hold behavior"
      ]
    },
    {
      "id": "S4",
      "title": "Google Cloud Free Trial and Free Tier",
      "url": "https://cloud.google.com/free",
      "source_type": "observed-public-ui",
      "accessed_at": "2026-07-22",
      "evidence_supported": [
        "Get started for free CTA",
        "Multiple product free-tier and solution offers"
      ]
    }
  ],
  "uncertainties": [
    {
      "question": "Which job-function or product first-success outcome should define the Google Cloud shortest path?",
      "impact": "Required actions, billing gates, and terminal signals differ across Application development setup, Cloud Run deploy, Jump Start Solutions, and other product quickstarts.",
      "evidence_needed": "Human selection of one bounded developer goal, then a fresh walkthrough of that route from Free Trial signup through the observable terminal."
    },
    {
      "question": "What exact public signup fields appear for a new Google identity Free Trial flow in the current console?",
      "impact": "Field counts for account creation cannot be verified without inventing controls behind Google sign-in.",
      "evidence_needed": "Dated screenshots or a read-only walkthrough of the live Free Trial signup forms for a new account."
    }
  ],
  "counts": null
}
